### ISSUE TITLE
[BUG]tftp not works with ipv6 only ipv4  with bridge mode 

### ISSUE THREAD

**Issue by mohamedlablouo** [docker/compose#11495]
### Description

```version: '2.4'

services:
  tftp:
    image: mcchae/tftp-server
    container_name: tftp_server
    ports:
      - "69:69/udp"
    volumes:
      - ${PWD}/dhv/tftp:/data
    command: ["in.tftpd", "-L", "-vvv", "-u", "root", "--secure", "--create", "-a", "0.0.0.0:69", "-a", "[::]:69", "/data"]
    networks:
      default1:
        ipv6_address: fd00:cafe:face:feeb::10

networks:
  default1:
    driver: bridge
    enable_ipv6: true
    ipam:
      config:
        - subnet: "fd00:cafe:face:feeb::/64"   changing the network to the host work for me but in bridge ipv6 not work any help i appreciate it please
        ```

### Steps To Reproduce

services:
  tftp:
    image: mcchae/tftp-server
    container_name: tftp_server
    ports:
      - "69:69/udp"
    volumes:
      - ${PWD}/dhv/tftp:/data
    command: ["in.tftpd", "-L", "-vvv", "-u", "root", "--secure", "--create", "-a", "0.0.0.0:69", "-a", "[::]:69", "/data"]
    networks:
      default1:
        ipv6_address: fd00:cafe:face:feeb::10

networks:
  default1:
    driver: bridge
    enable_ipv6: true
    ipam:
      config:
        - subnet: "fd00:cafe:face:feeb::/64" changing the network to the host work for me but in bridge ipv6 not work any help i appreciate it please       
       try to do      
        tftp -i  [2001:1::101]  get  hello.txt >>connection timeout 

root@mohamed:/home/roote/docker-tftp-server2# docker network inspect 1cc029852332
[
    {
        "Name": "docker-tftp-server2_default1",
        "Id": "1cc0298523325b43c9dc5ee27de8d18b04df455131f38a5439beca01fde18be7",
        "Created": "2024-02-13T11:13:28.305588052+01:00",
        "Scope": "local",
        "Driver": "bridge",
        "EnableIPv6": true,
        "IPAM": {
            "Driver": "default",
            "Options": null,
            "Config": [
                {
                    "Subnet": "192.168.176.0/20",
                    "Gateway": "192.168.176.1"
                },
                {
                    "Subnet": "fd00:cafe:face:feeb::/64"
                }
            ]
        },
        "Internal": false,
        "Attachable": false,
        "Ingress": false,
        "ConfigFrom": {
            "Network": ""
        },
        "ConfigOnly": false,
        "Containers": {
            "d4a3e5d3232b2a7bbe1069fe4885e987b2e8bb049437b8c87835946c40eb45ef": {
                "Name": "tftp_server",
                "EndpointID": "97dd66abdc9e9d023d2b1020fad72993fe53077fb9157d5fe14ff986d3b6156e",
                "MacAddress": "02:42:c0:a8:b0:02",
                "IPv4Address": "192.168.176.2/20",
                "IPv6Address": "fd00:cafe:face:feeb::10/64"
            }
        },
        "Options": {},
        "Labels": {
            "com.docker.compose.network": "default1",
            "com.docker.compose.project": "docker-tftp-server2",
            "com.docker.compose.version": "2.20.3"
        }
    }
]
tcpdump from container ```
```  tcpdump: verbose output suppressed, use -v or -vv for full protocol decode
listening on eth0, link-type EN10MB (Ethernet), capture size 262144 bytes
15:51:35.908404 IP 192.168.1.12.45107 > e05809badfcc.69:  49 RRQ "hello.txt" octet tsize 0 blksize 1468 timeout 5
15:52:15.790804 IP6 mohamed.local.34300 > e05809badfcc.69:  49 RRQ "hello.txt" octet tsize 0 blksize 1468 timeout 5
15:52:21.793896 IP6 mohamed.local.34300 > e05809badfcc.69:  49 RRQ "hello.txt" octet tsize 0 blksize 1468 timeout 5
15:52:27.798304 IP6 mohamed.local.34300 > e05809badfcc.69:  49 RRQ "hello.txt" octet tsize 0 blksize 1468 timeout 5
15:52:33.803016 IP6 mohamed.local.34300 > e05809badfcc.69:  49 RRQ "hello.txt" octet tsize 0 blksize 1468 timeout 5' 
``` 

### Compose Version

```Text
2.4


### Docker Environment

_No response_

### Anything else?

_No response_

**Comment by ndeloof** [comment]
Can you please try to reproduce this issue using a plain `docker network create` and `docker run ...` command? 
This will help us to diagnose this is a Compose bug or a Docker engine issue

**Comment by mohamedlablouo** [comment]
> Can you please try to reproduce this issue using a plain `docker network create` and `docker run ...` command? This will help us to diagnose this is a Compose bug or a Docker engine issue

i confirm also the same issue is reproducible with docker engine '''  WARNING: Ignoring http://dl-cdn.alpinelinux.org/alpine/v3.10/community/x86_64/APKINDEX.tar.gz: temporary error (try again later)
OK: 7 MiB in 17 packages
/ # tcpdump port 69
tcpdump: verbose output suppressed, use -v or -vv for full protocol decode
listening on eth0, link-type EN10MB (Ethernet), capture size 262144 bytes
08:38:48.632633 IP 192.168.1.12.43681 > 4fdec26bdd5a.69:  49 RRQ "hello.txt" octet tsize 0 blksize 1468 timeout 5
08:38:55.963123 IP6 mohamed.local.52760 > 4fdec26bdd5a.69:  49 RRQ "hello.txt" octet tsize 0 blksize 1468 timeout 5
08:39:01.967434 IP6 mohamed.local.52760 > 4fdec26bdd5a.69:  49 RRQ "hello.txt" octet tsize 0 blksize 1468 timeout 5
08:39:07.972401 IP6 mohamed.local.52760 > 4fdec26bdd5a.69:  49 RRQ "hello.txt" octet tsize 0 blksize 1468 timeout 5
08:39:13.975605 IP6 mohamed.local.52760 > 4fdec26bdd5a.69:  49 RRQ "hello.txt" octet tsize 0 blksize 1468 timeout 5
08:39:19.980811 IP6 mohamed.local.52760 > 4fdec26bdd5a.69:  49 RRQ "hello.txt" octet tsize 0 blksize 1468 timeout 5 '''
 @ndeloof

**Comment by ndeloof** [comment]
ok, then please report to https://github.com/moby/moby with a reproduction example

**Comment by mohamedlablouo** [comment]
@ndeloof  thanks do you see its as a bug ?

**Comment by ndeloof** [comment]
I'm not confident enough with engine networking to tell :)
